commit	RMSE	status	model	description
run_2026-03-21_172152	0.093428	discard	rescnn_gru	exp251 e8 rescnn_96; test_loss=0.008822 mae=0.068477
run_2026-03-21_172152	0.049434	discard	nbeats	exp251 e8 rescnn_96; test_loss=0.002546 mae=0.035481
run_2026-03-21_172152	0.086228	discard	nhits	exp251 e8 rescnn_96; test_loss=0.008698 mae=0.048390
run_2026-03-21_172418	0.152203	discard	bilstm	exp252 e16 rescnn_112_96; test_loss=0.024865 mae=0.093013
run_2026-03-21_172418	0.207423	discard	transformer	exp252 e16 rescnn_112_96; test_loss=0.048017 mae=0.119406
run_2026-03-21_172418	0.066039	keep	lstnet	exp252 e16 rescnn_112_96; test_loss=0.004416 mae=0.047070
run_2026-03-21_172418	0.102759	discard	rescnn_gru	exp252 e16 rescnn_112_96; test_loss=0.011247 mae=0.071490
run_2026-03-21_172418	0.066865	discard	nbeats	exp252 e16 rescnn_112_96; test_loss=0.004505 mae=0.052981
run_2026-03-21_172418	0.107889	discard	nhits	exp252 e16 rescnn_112_96; test_loss=0.014393 mae=0.045727
run_2026-03-21_172531	0.088638	discard	bilstm	exp253 e8 rescnn_96_112; test_loss=0.008077 mae=0.062052
run_2026-03-21_172531	0.228854	discard	transformer	exp253 e8 rescnn_96_112; test_loss=0.059466 mae=0.122083
run_2026-03-21_172531	0.122846	discard	lstnet	exp253 e8 rescnn_96_112; test_loss=0.017139 mae=0.070435
run_2026-03-21_172531	0.100080	discard	rescnn_gru	exp253 e8 rescnn_96_112; test_loss=0.010399 mae=0.072834
run_2026-03-21_172531	0.059931	discard	nbeats	exp253 e8 rescnn_96_112; test_loss=0.003628 mae=0.045025
run_2026-03-21_172531	0.087178	discard	nhits	exp253 e8 rescnn_96_112; test_loss=0.008740 mae=0.053120
run_2026-03-21_172731	0.106049	discard	bilstm	exp254 e12 nbeats_320_b5; test_loss=0.011641 mae=0.070446
run_2026-03-21_172731	0.187725	discard	transformer	exp254 e12 nbeats_320_b5; test_loss=0.037655 mae=0.112161
run_2026-03-21_172731	0.094748	discard	lstnet	exp254 e12 nbeats_320_b5; test_loss=0.009509 mae=0.066051
run_2026-03-21_172731	0.118998	discard	rescnn_gru	exp254 e12 nbeats_320_b5; test_loss=0.014914 mae=0.081097
run_2026-03-21_172731	0.065011	discard	nbeats	exp254 e12 nbeats_320_b5; test_loss=0.004287 mae=0.049321
run_2026-03-21_172731	0.096729	discard	nhits	exp254 e12 nbeats_320_b5; test_loss=0.011398 mae=0.045092
run_2026-03-21_172856	0.121153	discard	bilstm	exp255 e8 nbeats_384_b6; test_loss=0.015399 mae=0.075253
run_2026-03-21_172856	0.213723	discard	transformer	exp255 e8 nbeats_384_b6; test_loss=0.050307 mae=0.117520
run_2026-03-21_172856	0.126546	discard	lstnet	exp255 e8 nbeats_384_b6; test_loss=0.018262 mae=0.071056
run_2026-03-21_172856	0.151936	discard	rescnn_gru	exp255 e8 nbeats_384_b6; test_loss=0.026491 mae=0.084948
run_2026-03-21_172856	0.052992	discard	nbeats	exp255 e8 nbeats_384_b6; test_loss=0.002845 mae=0.039881
run_2026-03-21_172856	0.083581	discard	nhits	exp255 e8 nbeats_384_b6; test_loss=0.007937 mae=0.052700
run_2026-03-21_173108	0.108390	discard	bilstm	exp256 e12 nbeats_448_b6; test_loss=0.012103 mae=0.075394
run_2026-03-21_173108	0.213081	discard	transformer	exp256 e12 nbeats_448_b6; test_loss=0.051894 mae=0.108302
run_2026-03-21_173108	0.088385	discard	lstnet	exp256 e12 nbeats_448_b6; test_loss=0.008370 mae=0.059585
run_2026-03-21_173108	0.105763	discard	rescnn_gru	exp256 e12 nbeats_448_b6; test_loss=0.012199 mae=0.068313
run_2026-03-21_173108	0.053021	discard	nbeats	exp256 e12 nbeats_448_b6; test_loss=0.002867 mae=0.039817
run_2026-03-21_173108	0.084774	discard	nhits	exp256 e12 nbeats_448_b6; test_loss=0.008209 mae=0.051751
run_2026-03-21_173248	0.104823	discard	bilstm	exp257 e8 nhits_320_b3; test_loss=0.011527 mae=0.066974
run_2026-03-21_173248	0.233536	discard	transformer	exp257 e8 nhits_320_b3; test_loss=0.060104 mae=0.138261
run_2026-03-21_173248	0.107008	discard	lstnet	exp257 e8 nhits_320_b3; test_loss=0.012823 mae=0.065435
run_2026-03-21_173248	0.099148	discard	rescnn_gru	exp257 e8 nhits_320_b3; test_loss=0.009965 mae=0.071097
run_2026-03-21_173248	0.057380	discard	nbeats	exp257 e8 nhits_320_b3; test_loss=0.003351 mae=0.043294
run_2026-03-21_173248	0.069577	discard	nhits	exp257 e8 nhits_320_b3; test_loss=0.005445 mae=0.044579
run_2026-03-21_173620	0.121397	discard	bilstm	exp258 e16 nhits_384_b4; test_loss=0.014886 mae=0.086438
run_2026-03-21_173620	0.193421	discard	transformer	exp258 e16 nhits_384_b4; test_loss=0.042663 mae=0.097649
run_2026-03-21_173620	0.070144	discard	lstnet	exp258 e16 nhits_384_b4; test_loss=0.005117 mae=0.047637
run_2026-03-21_173620	0.114218	discard	rescnn_gru	exp258 e16 nhits_384_b4; test_loss=0.013616 mae=0.078862
run_2026-03-21_173620	0.058966	discard	nbeats	exp258 e16 nhits_384_b4; test_loss=0.003524 mae=0.045377
run_2026-03-21_173620	0.091628	discard	nhits	exp258 e16 nhits_384_b4; test_loss=0.010021 mae=0.048359
run_2026-03-21_173746	0.128008	discard	bilstm	exp259 e8 nhits_448_b4; test_loss=0.017829 mae=0.077868
run_2026-03-21_173746	0.180067	discard	transformer	exp259 e8 nhits_448_b4; test_loss=0.036500 mae=0.099755
run_2026-03-21_173746	0.103105	discard	lstnet	exp259 e8 nhits_448_b4; test_loss=0.011672 mae=0.064420
run_2026-03-21_173746	0.076484	discard	rescnn_gru	exp259 e8 nhits_448_b4; test_loss=0.005900 mae=0.054905
run_2026-03-21_173746	0.064163	discard	nbeats	exp259 e8 nhits_448_b4; test_loss=0.004259 mae=0.048626
run_2026-03-21_173746	0.094890	discard	nhits	exp259 e8 nhits_448_b4; test_loss=0.010376 mae=0.056734
run_2026-03-21_173944	0.095073	discard	bilstm	exp260 e12 wd1e-5; test_loss=0.009638 mae=0.062035
run_2026-03-21_173944	0.152438	discard	transformer	exp260 e12 wd1e-5; test_loss=0.025918 mae=0.087050
run_2026-03-21_173944	0.103278	discard	lstnet	exp260 e12 wd1e-5; test_loss=0.012037 mae=0.058822
run_2026-03-21_173944	0.104627	discard	rescnn_gru	exp260 e12 wd1e-5; test_loss=0.011475 mae=0.074295
run_2026-03-21_173944	0.058831	discard	nbeats	exp260 e12 wd1e-5; test_loss=0.003517 mae=0.044932
run_2026-03-21_173944	0.085345	discard	nhits	exp260 e12 wd1e-5; test_loss=0.008579 mae=0.047014
run_2026-03-21_174203	0.096096	discard	bilstm	exp261 e8 wd5e-5; test_loss=0.009404 mae=0.067189
run_2026-03-21_174203	0.149828	discard	transformer	exp261 e8 wd5e-5; test_loss=0.023911 mae=0.093372
run_2026-03-21_174203	0.111604	discard	lstnet	exp261 e8 wd5e-5; test_loss=0.013641 mae=0.071886
run_2026-03-21_174203	0.129427	discard	rescnn_gru	exp261 e8 wd5e-5; test_loss=0.018254 mae=0.085816
run_2026-03-21_174203	0.057755	discard	nbeats	exp261 e8 wd5e-5; test_loss=0.003389 mae=0.042338
run_2026-03-21_174203	0.081619	discard	nhits	exp261 e8 wd5e-5; test_loss=0.007846 mae=0.044138
run_2026-03-21_174543	0.142517	discard	bilstm	exp262 e12 lr7e-4; test_loss=0.020569 mae=0.099051
run_2026-03-21_174543	0.184600	discard	transformer	exp262 e12 lr7e-4; test_loss=0.037217 mae=0.111430
run_2026-03-21_174543	0.099020	discard	lstnet	exp262 e12 lr7e-4; test_loss=0.010343 mae=0.068760
run_2026-03-21_174543	0.103409	discard	rescnn_gru	exp262 e12 lr7e-4; test_loss=0.011153 mae=0.069146
run_2026-03-21_174543	0.062708	discard	nbeats	exp262 e12 lr7e-4; test_loss=0.003957 mae=0.046690
run_2026-03-21_174543	0.082795	discard	nhits	exp262 e12 lr7e-4; test_loss=0.007966 mae=0.048739
run_2026-03-21_175144	0.118529	discard	bilstm	exp263 e8 lr3e-4_e20; test_loss=0.015505 mae=0.068694
run_2026-03-21_175144	0.200037	discard	transformer	exp263 e8 lr3e-4_e20; test_loss=0.043870 mae=0.117494
run_2026-03-21_175144	0.108732	discard	lstnet	exp263 e8 lr3e-4_e20; test_loss=0.013023 mae=0.070451
run_2026-03-21_175144	0.127047	discard	rescnn_gru	exp263 e8 lr3e-4_e20; test_loss=0.016854 mae=0.090696
run_2026-03-21_175144	0.052158	discard	nbeats	exp263 e8 lr3e-4_e20; test_loss=0.002832 mae=0.037555
run_2026-03-21_175144	0.108236	discard	nhits	exp263 e8 lr3e-4_e20; test_loss=0.014548 mae=0.045850
run_2026-03-21_175549	0.116068	discard	bilstm	exp264 e16 batch80; test_loss=0.013964 mae=0.081815
run_2026-03-21_175549	0.185618	discard	transformer	exp264 e16 batch80; test_loss=0.044791 mae=0.093567
run_2026-03-21_175549	0.100064	discard	lstnet	exp264 e16 batch80; test_loss=0.012025 mae=0.063225
run_2026-03-21_175549	0.083006	discard	rescnn_gru	exp264 e16 batch80; test_loss=0.007060 mae=0.059041
run_2026-03-21_175549	0.067183	discard	nbeats	exp264 e16 batch80; test_loss=0.004600 mae=0.051179
run_2026-03-21_175549	0.065893	discard	nhits	exp264 e16 batch80; test_loss=0.005469 mae=0.039875
run_2026-03-21_175737	0.101814	discard	bilstm	exp265 e8 batch96; test_loss=0.010755 mae=0.065660
run_2026-03-21_175737	0.216119	discard	transformer	exp265 e8 batch96; test_loss=0.051170 mae=0.126407
run_2026-03-21_175737	0.103082	discard	lstnet	exp265 e8 batch96; test_loss=0.010991 mae=0.073500
run_2026-03-21_175737	0.109643	discard	rescnn_gru	exp265 e8 batch96; test_loss=0.012069 mae=0.082490
run_2026-03-21_175737	0.073068	discard	nbeats	exp265 e8 batch96; test_loss=0.005438 mae=0.053484
run_2026-03-21_175737	0.083534	discard	nhits	exp265 e8 batch96; test_loss=0.007715 mae=0.047544
run_2026-03-21_180214	0.126988	discard	bilstm	exp266 e12 bilstm_h160; test_loss=0.017549 mae=0.078736
run_2026-03-21_180214	0.153495	discard	transformer	exp266 e12 bilstm_h160; test_loss=0.025535 mae=0.094065
run_2026-03-21_180214	0.082183	discard	lstnet	exp266 e12 bilstm_h160; test_loss=0.007148 mae=0.055507
run_2026-03-21_180214	0.091917	discard	rescnn_gru	exp266 e12 bilstm_h160; test_loss=0.008648 mae=0.065915
run_2026-03-21_180214	0.076873	discard	nbeats	exp266 e12 bilstm_h160; test_loss=0.005944 mae=0.060115
run_2026-03-21_180214	0.103642	discard	nhits	exp266 e12 bilstm_h160; test_loss=0.012676 mae=0.056973
run_2026-03-21_180524	0.097326	discard	bilstm	exp267 e8 bilstm_h192; test_loss=0.010148 mae=0.063056
run_2026-03-21_180524	0.206753	discard	transformer	exp267 e8 bilstm_h192; test_loss=0.046682 mae=0.119005
run_2026-03-21_180524	0.093599	discard	lstnet	exp267 e8 bilstm_h192; test_loss=0.009138 mae=0.066092
run_2026-03-21_180524	0.115996	discard	rescnn_gru	exp267 e8 bilstm_h192; test_loss=0.014340 mae=0.080712
run_2026-03-21_180524	0.050843	discard	nbeats	exp267 e8 bilstm_h192; test_loss=0.002626 mae=0.037511
run_2026-03-21_180524	0.088298	discard	nhits	exp267 e8 bilstm_h192; test_loss=0.009215 mae=0.048340
run_2026-03-21_180912	0.127915	discard	bilstm	exp268 e12 bilstm_l3; test_loss=0.018118 mae=0.074165
run_2026-03-21_180912	0.206761	discard	transformer	exp268 e12 bilstm_l3; test_loss=0.047531 mae=0.117427
run_2026-03-21_180912	0.124201	discard	lstnet	exp268 e12 bilstm_l3; test_loss=0.017822 mae=0.067254
run_2026-03-21_180912	0.120320	discard	rescnn_gru	exp268 e12 bilstm_l3; test_loss=0.015470 mae=0.082693
run_2026-03-21_180912	0.053125	discard	nbeats	exp268 e12 bilstm_l3; test_loss=0.002955 mae=0.038345
run_2026-03-21_180912	0.108139	discard	nhits	exp268 e12 bilstm_l3; test_loss=0.014592 mae=0.044099
run_2026-03-21_181144	0.139939	discard	bilstm	exp269 e8 tr_d128_ff384; test_loss=0.021322 mae=0.086177
run_2026-03-21_181144	0.145919	discard	transformer	exp269 e8 tr_d128_ff384; test_loss=0.022315 mae=0.096809
run_2026-03-21_181144	0.100581	discard	lstnet	exp269 e8 tr_d128_ff384; test_loss=0.010970 mae=0.066458
run_2026-03-21_181144	0.108722	discard	rescnn_gru	exp269 e8 tr_d128_ff384; test_loss=0.012995 mae=0.070780
run_2026-03-21_181144	0.058479	discard	nbeats	exp269 e8 tr_d128_ff384; test_loss=0.003509 mae=0.045013
run_2026-03-21_181144	0.093298	discard	nhits	exp269 e8 tr_d128_ff384; test_loss=0.010197 mae=0.051616
run_2026-03-21_181700	0.136266	discard	bilstm	exp270 e16 tr_l2; test_loss=0.019157 mae=0.093639
run_2026-03-21_181700	0.185002	discard	transformer	exp270 e16 tr_l2; test_loss=0.035626 mae=0.130982
run_2026-03-21_181700	0.081038	discard	lstnet	exp270 e16 tr_l2; test_loss=0.006810 mae=0.057227
run_2026-03-21_181700	0.111967	discard	rescnn_gru	exp270 e16 tr_l2; test_loss=0.013001 mae=0.079102
run_2026-03-21_181700	0.059048	discard	nbeats	exp270 e16 tr_l2; test_loss=0.003630 mae=0.042941
run_2026-03-21_181700	0.078064	discard	nhits	exp270 e16 tr_l2; test_loss=0.007050 mae=0.045962
run_2026-03-21_181930	0.106395	discard	bilstm	exp271 e8 tr_drop005; test_loss=0.011683 mae=0.071085
run_2026-03-21_181930	0.204647	discard	transformer	exp271 e8 tr_drop005; test_loss=0.046902 mae=0.107335
run_2026-03-21_181930	0.093055	discard	lstnet	exp271 e8 tr_drop005; test_loss=0.009445 mae=0.060142
run_2026-03-21_181930	0.096214	discard	rescnn_gru	exp271 e8 tr_drop005; test_loss=0.009565 mae=0.068493
run_2026-03-21_181930	0.056385	discard	nbeats	exp271 e8 tr_drop005; test_loss=0.003248 mae=0.041240
run_2026-03-21_181930	0.083925	discard	nhits	exp271 e8 tr_drop005; test_loss=0.008346 mae=0.043758
run_2026-03-21_182309	0.103365	discard	bilstm	exp272 e12 lstnet_96; test_loss=0.010862 mae=0.074224
run_2026-03-21_182309	0.201673	discard	transformer	exp272 e12 lstnet_96; test_loss=0.044261 mae=0.107122
run_2026-03-21_182309	0.079355	discard	lstnet	exp272 e12 lstnet_96; test_loss=0.006427 mae=0.058588
run_2026-03-21_182309	0.096257	discard	rescnn_gru	exp272 e12 lstnet_96; test_loss=0.009484 mae=0.066742
run_2026-03-21_182309	0.049558	discard	nbeats	exp272 e12 lstnet_96; test_loss=0.002518 mae=0.036795
run_2026-03-21_182309	0.092484	discard	nhits	exp272 e12 lstnet_96; test_loss=0.010168 mae=0.048623
run_2026-03-21_182515	0.107298	discard	bilstm	exp273 e8 lstnet_112_96; test_loss=0.012195 mae=0.069903
run_2026-03-21_182515	0.146415	discard	transformer	exp273 e8 lstnet_112_96; test_loss=0.023089 mae=0.090968
run_2026-03-21_182515	0.094543	discard	lstnet	exp273 e8 lstnet_112_96; test_loss=0.009018 mae=0.070484
run_2026-03-21_182515	0.094181	discard	rescnn_gru	exp273 e8 lstnet_112_96; test_loss=0.009012 mae=0.067085
run_2026-03-21_182515	0.059722	discard	nbeats	exp273 e8 lstnet_112_96; test_loss=0.003620 mae=0.046495
run_2026-03-21_182515	0.116764	discard	nhits	exp273 e8 lstnet_112_96; test_loss=0.016683 mae=0.054673
run_2026-03-21_182722	0.116120	discard	bilstm	exp274 e12 lstnet_96_112; test_loss=0.014122 mae=0.077581
run_2026-03-21_182722	0.188773	discard	transformer	exp274 e12 lstnet_96_112; test_loss=0.038977 mae=0.109157
run_2026-03-21_182722	0.085133	discard	lstnet	exp274 e12 lstnet_96_112; test_loss=0.007798 mae=0.056491
run_2026-03-21_182722	0.109961	discard	rescnn_gru	exp274 e12 lstnet_96_112; test_loss=0.012564 mae=0.078297
run_2026-03-21_182722	0.052399	discard	nbeats	exp274 e12 lstnet_96_112; test_loss=0.002869 mae=0.037976
run_2026-03-21_182722	0.082142	discard	nhits	exp274 e12 lstnet_96_112; test_loss=0.007687 mae=0.050525
run_2026-03-21_182838	0.124125	discard	bilstm	exp275 e8 rescnn_96; test_loss=0.016456 mae=0.076509
run_2026-03-21_182838	0.172668	discard	transformer	exp275 e8 rescnn_96; test_loss=0.032573 mae=0.104065
run_2026-03-21_182838	0.093607	discard	lstnet	exp275 e8 rescnn_96; test_loss=0.009386 mae=0.064175
run_2026-03-21_182838	0.093408	discard	rescnn_gru	exp275 e8 rescnn_96; test_loss=0.008992 mae=0.067745
run_2026-03-21_182838	0.056602	discard	nbeats	exp275 e8 rescnn_96; test_loss=0.003261 mae=0.043036
run_2026-03-21_182838	0.069541	discard	nhits	exp275 e8 rescnn_96; test_loss=0.005373 mae=0.045938
run_2026-03-21_183222	0.116417	discard	bilstm	exp276 e16 rescnn_112_96; test_loss=0.013861 mae=0.077787
run_2026-03-21_183222	0.198156	discard	transformer	exp276 e16 rescnn_112_96; test_loss=0.042949 mae=0.117608
run_2026-03-21_183222	0.094004	discard	lstnet	exp276 e16 rescnn_112_96; test_loss=0.009513 mae=0.061845
run_2026-03-21_183222	0.090357	discard	rescnn_gru	exp276 e16 rescnn_112_96; test_loss=0.008431 mae=0.062100
run_2026-03-21_183222	0.052873	discard	nbeats	exp276 e16 rescnn_112_96; test_loss=0.002850 mae=0.039475
run_2026-03-21_183222	0.078541	discard	nhits	exp276 e16 rescnn_112_96; test_loss=0.007364 mae=0.039081
run_2026-03-21_183454	0.107463	discard	bilstm	exp277 e8 rescnn_96_112; test_loss=0.011942 mae=0.075517
run_2026-03-21_183454	0.168117	discard	transformer	exp277 e8 rescnn_96_112; test_loss=0.030531 mae=0.101183
run_2026-03-21_183454	0.097286	discard	lstnet	exp277 e8 rescnn_96_112; test_loss=0.010004 mae=0.065505
run_2026-03-21_183454	0.090963	discard	rescnn_gru	exp277 e8 rescnn_96_112; test_loss=0.009033 mae=0.058590
run_2026-03-21_183454	0.049642	discard	nbeats	exp277 e8 rescnn_96_112; test_loss=0.002518 mae=0.036551
run_2026-03-21_183454	0.090918	discard	nhits	exp277 e8 rescnn_96_112; test_loss=0.009913 mae=0.046666
run_2026-03-21_183857	0.132343	discard	bilstm	exp278 e12 nbeats_320_b5; test_loss=0.019450 mae=0.070864
run_2026-03-21_183857	0.167190	discard	transformer	exp278 e12 nbeats_320_b5; test_loss=0.031997 mae=0.083971
run_2026-03-21_183857	0.091553	discard	lstnet	exp278 e12 nbeats_320_b5; test_loss=0.009089 mae=0.060068
run_2026-03-21_183857	0.108252	discard	rescnn_gru	exp278 e12 nbeats_320_b5; test_loss=0.012721 mae=0.070391
run_2026-03-21_183857	0.062547	discard	nbeats	exp278 e12 nbeats_320_b5; test_loss=0.003933 mae=0.048610
run_2026-03-21_183857	0.139420	discard	nhits	exp278 e12 nbeats_320_b5; test_loss=0.024535 mae=0.050682
run_2026-03-21_184146	0.100044	discard	bilstm	exp279 e8 nbeats_384_b6; test_loss=0.010796 mae=0.062590
run_2026-03-21_184146	0.191258	discard	transformer	exp279 e8 nbeats_384_b6; test_loss=0.040631 mae=0.109318
run_2026-03-21_184146	0.105917	discard	lstnet	exp279 e8 nbeats_384_b6; test_loss=0.011651 mae=0.074702
run_2026-03-21_184146	0.101298	discard	rescnn_gru	exp279 e8 nbeats_384_b6; test_loss=0.010508 mae=0.072917
run_2026-03-21_184146	0.065470	discard	nbeats	exp279 e8 nbeats_384_b6; test_loss=0.004321 mae=0.050207
run_2026-03-21_184146	0.102656	discard	nhits	exp279 e8 nbeats_384_b6; test_loss=0.012772 mae=0.050352
run_2026-03-21_184539	0.122431	discard	bilstm	exp280 e12 nbeats_448_b6; test_loss=0.015102 mae=0.086378
run_2026-03-21_184539	0.185035	discard	transformer	exp280 e12 nbeats_448_b6; test_loss=0.037963 mae=0.109427
run_2026-03-21_184539	0.110066	discard	lstnet	exp280 e12 nbeats_448_b6; test_loss=0.013686 mae=0.061720
run_2026-03-21_184539	0.105973	discard	rescnn_gru	exp280 e12 nbeats_448_b6; test_loss=0.011902 mae=0.073406
run_2026-03-21_184539	0.054641	discard	nbeats	exp280 e12 nbeats_448_b6; test_loss=0.002996 mae=0.041953
run_2026-03-21_184539	0.109464	discard	nhits	exp280 e12 nbeats_448_b6; test_loss=0.014884 mae=0.044815
run_2026-03-21_184804	0.107925	discard	bilstm	exp281 e8 nhits_320_b3; test_loss=0.011978 mae=0.075301
run_2026-03-21_184804	0.199154	discard	transformer	exp281 e8 nhits_320_b3; test_loss=0.044637 mae=0.103385
run_2026-03-21_184804	0.131831	discard	lstnet	exp281 e8 nhits_320_b3; test_loss=0.020317 mae=0.066750
run_2026-03-21_184804	0.116311	discard	rescnn_gru	exp281 e8 nhits_320_b3; test_loss=0.014129 mae=0.082299
run_2026-03-21_184804	0.053922	discard	nbeats	exp281 e8 nhits_320_b3; test_loss=0.002972 mae=0.040229
run_2026-03-21_184804	0.081511	discard	nhits	exp281 e8 nhits_320_b3; test_loss=0.007716 mae=0.047178
run_2026-03-21_185254	0.104066	discard	bilstm	exp282 e16 nhits_384_b4; test_loss=0.011508 mae=0.062165
run_2026-03-21_185254	0.177563	discard	transformer	exp282 e16 nhits_384_b4; test_loss=0.035861 mae=0.090230
run_2026-03-21_185254	0.092119	discard	lstnet	exp282 e16 nhits_384_b4; test_loss=0.009106 mae=0.061210
run_2026-03-21_185254	0.094741	discard	rescnn_gru	exp282 e16 nhits_384_b4; test_loss=0.009133 mae=0.068555
run_2026-03-21_185254	0.064532	discard	nbeats	exp282 e16 nhits_384_b4; test_loss=0.004215 mae=0.051040
run_2026-03-21_185254	0.086336	discard	nhits	exp282 e16 nhits_384_b4; test_loss=0.008792 mae=0.047074
run_2026-03-21_185524	0.108989	discard	bilstm	exp283 e8 nhits_448_b4; test_loss=0.012628 mae=0.068294
run_2026-03-21_185524	0.149956	discard	transformer	exp283 e8 nhits_448_b4; test_loss=0.023543 mae=0.100702
run_2026-03-21_185524	0.106924	discard	lstnet	exp283 e8 nhits_448_b4; test_loss=0.012603 mae=0.069484
run_2026-03-21_185524	0.125554	discard	rescnn_gru	exp283 e8 nhits_448_b4; test_loss=0.016884 mae=0.085883
run_2026-03-21_185524	0.054780	discard	nbeats	exp283 e8 nhits_448_b4; test_loss=0.003078 mae=0.040935
run_2026-03-21_185524	0.077229	discard	nhits	exp283 e8 nhits_448_b4; test_loss=0.006392 mae=0.052652
run_2026-03-21_185909	0.109948	discard	bilstm	exp284 e12 wd1e-5; test_loss=0.012686 mae=0.073665
run_2026-03-21_185909	0.176505	discard	transformer	exp284 e12 wd1e-5; test_loss=0.034096 mae=0.098599
run_2026-03-21_185909	0.080771	discard	lstnet	exp284 e12 wd1e-5; test_loss=0.006834 mae=0.057511
run_2026-03-21_185909	0.104768	discard	rescnn_gru	exp284 e12 wd1e-5; test_loss=0.011246 mae=0.075357
run_2026-03-21_185909	0.059688	discard	nbeats	exp284 e12 wd1e-5; test_loss=0.003607 mae=0.045983
run_2026-03-21_185909	0.101996	discard	nhits	exp284 e12 wd1e-5; test_loss=0.012545 mae=0.052907
run_2026-03-21_190139	0.102306	discard	bilstm	exp285 e8 wd5e-5; test_loss=0.010668 mae=0.071253
run_2026-03-21_190139	0.215061	discard	transformer	exp285 e8 wd5e-5; test_loss=0.051063 mae=0.123447
run_2026-03-21_190139	0.077684	discard	lstnet	exp285 e8 wd5e-5; test_loss=0.006259 mae=0.054407
run_2026-03-21_190139	0.109913	discard	rescnn_gru	exp285 e8 wd5e-5; test_loss=0.012790 mae=0.076027
run_2026-03-21_190139	0.061635	discard	nbeats	exp285 e8 wd5e-5; test_loss=0.003864 mae=0.047050
run_2026-03-21_190139	0.074887	discard	nhits	exp285 e8 wd5e-5; test_loss=0.006253 mae=0.047947
run_2026-03-21_190517	0.149127	discard	bilstm	exp286 e12 lr7e-4; test_loss=0.023028 mae=0.099427
run_2026-03-21_190517	0.217772	discard	transformer	exp286 e12 lr7e-4; test_loss=0.053189 mae=0.123203
run_2026-03-21_190517	0.071918	discard	lstnet	exp286 e12 lr7e-4; test_loss=0.005259 mae=0.051244
run_2026-03-21_190517	0.090298	discard	rescnn_gru	exp286 e12 lr7e-4; test_loss=0.008166 mae=0.062787
run_2026-03-21_190517	0.052815	discard	nbeats	exp286 e12 lr7e-4; test_loss=0.002934 mae=0.038080
run_2026-03-21_190517	0.071072	discard	nhits	exp286 e12 lr7e-4; test_loss=0.005797 mae=0.041475
run_2026-03-21_191117	0.091323	discard	bilstm	exp287 e8 lr3e-4_e20; test_loss=0.008717 mae=0.059090
