commit	RMSE	status	model	description
run_2026-03-21_191117	0.157006	discard	transformer	exp287 e8 lr3e-4_e20; test_loss=0.027342 mae=0.089656
run_2026-03-21_191117	0.105710	discard	lstnet	exp287 e8 lr3e-4_e20; test_loss=0.012327 mae=0.066240
run_2026-03-21_191117	0.102511	discard	rescnn_gru	exp287 e8 lr3e-4_e20; test_loss=0.011026 mae=0.070910
run_2026-03-21_191117	0.065530	discard	nbeats	exp287 e8 lr3e-4_e20; test_loss=0.004480 mae=0.047897
run_2026-03-21_191117	0.110109	discard	nhits	exp287 e8 lr3e-4_e20; test_loss=0.014786 mae=0.051026
run_2026-03-21_191522	0.115102	discard	bilstm	exp288 e16 batch80; test_loss=0.013595 mae=0.082853
run_2026-03-21_191522	0.198196	discard	transformer	exp288 e16 batch80; test_loss=0.049870 mae=0.105474
run_2026-03-21_191522	0.080864	discard	lstnet	exp288 e16 batch80; test_loss=0.007331 mae=0.054869
run_2026-03-21_191522	0.110156	discard	rescnn_gru	exp288 e16 batch80; test_loss=0.013252 mae=0.078238
run_2026-03-21_191522	0.063218	discard	nbeats	exp288 e16 batch80; test_loss=0.004191 mae=0.047483
run_2026-03-21_191522	0.095706	discard	nhits	exp288 e16 batch80; test_loss=0.012455 mae=0.052900
run_2026-03-21_191712	0.108725	discard	bilstm	exp289 e8 batch96; test_loss=0.012399 mae=0.072002
run_2026-03-21_191712	0.142521	discard	transformer	exp289 e8 batch96; test_loss=0.021290 mae=0.092828
run_2026-03-21_191712	0.127879	discard	lstnet	exp289 e8 batch96; test_loss=0.017649 mae=0.081293
run_2026-03-21_191712	0.108892	discard	rescnn_gru	exp289 e8 batch96; test_loss=0.012640 mae=0.069648
run_2026-03-21_191712	0.064876	discard	nbeats	exp289 e8 batch96; test_loss=0.004310 mae=0.046491
run_2026-03-21_191712	0.081163	discard	nhits	exp289 e8 batch96; test_loss=0.007028 mae=0.054995
run_2026-03-21_192147	0.099930	discard	bilstm	exp290 e12 bilstm_h160; test_loss=0.010403 mae=0.066065
run_2026-03-21_192147	0.190202	discard	transformer	exp290 e12 bilstm_h160; test_loss=0.040334 mae=0.104160
run_2026-03-21_192147	0.085532	discard	lstnet	exp290 e12 bilstm_h160; test_loss=0.007681 mae=0.058765
run_2026-03-21_192147	0.079411	discard	rescnn_gru	exp290 e12 bilstm_h160; test_loss=0.006344 mae=0.057902
run_2026-03-21_192147	0.061861	discard	nbeats	exp290 e12 bilstm_h160; test_loss=0.003978 mae=0.045534
run_2026-03-21_192147	0.092342	discard	nhits	exp290 e12 bilstm_h160; test_loss=0.010188 mae=0.047838
run_2026-03-21_192456	0.090215	discard	bilstm	exp291 e8 bilstm_h192; test_loss=0.008363 mae=0.062581
run_2026-03-21_192456	0.195716	discard	transformer	exp291 e8 bilstm_h192; test_loss=0.041597 mae=0.123781
run_2026-03-21_192456	0.095604	discard	lstnet	exp291 e8 bilstm_h192; test_loss=0.010021 mae=0.061125
run_2026-03-21_192456	0.097587	discard	rescnn_gru	exp291 e8 bilstm_h192; test_loss=0.009593 mae=0.071246
run_2026-03-21_192456	0.057804	discard	nbeats	exp291 e8 bilstm_h192; test_loss=0.003437 mae=0.043387
run_2026-03-21_192456	0.106021	discard	nhits	exp291 e8 bilstm_h192; test_loss=0.013968 mae=0.045734
run_2026-03-21_192845	0.099852	discard	bilstm	exp292 e12 bilstm_l3; test_loss=0.010365 mae=0.067407
run_2026-03-21_192845	0.193525	discard	transformer	exp292 e12 bilstm_l3; test_loss=0.042055 mae=0.105817
run_2026-03-21_192845	0.098134	discard	lstnet	exp292 e12 bilstm_l3; test_loss=0.010250 mae=0.066265
run_2026-03-21_192845	0.090115	discard	rescnn_gru	exp292 e12 bilstm_l3; test_loss=0.008202 mae=0.066464
run_2026-03-21_192845	0.053654	discard	nbeats	exp292 e12 bilstm_l3; test_loss=0.002946 mae=0.039112
run_2026-03-21_192845	0.111476	discard	nhits	exp292 e12 bilstm_l3; test_loss=0.015079 mae=0.055577
run_2026-03-21_193109	0.161172	discard	bilstm	exp293 e8 tr_d128_ff384; test_loss=0.028622 mae=0.097046
run_2026-03-21_193109	0.172252	discard	transformer	exp293 e8 tr_d128_ff384; test_loss=0.032027 mae=0.105210
run_2026-03-21_193109	0.090531	discard	lstnet	exp293 e8 tr_d128_ff384; test_loss=0.008273 mae=0.067525
run_2026-03-21_193109	0.109492	discard	rescnn_gru	exp293 e8 tr_d128_ff384; test_loss=0.012954 mae=0.073633
run_2026-03-21_193109	0.058545	discard	nbeats	exp293 e8 tr_d128_ff384; test_loss=0.003530 mae=0.043800
run_2026-03-21_193109	0.077669	discard	nhits	exp293 e8 tr_d128_ff384; test_loss=0.007080 mae=0.043654
run_2026-03-21_193626	0.108256	discard	bilstm	exp294 e16 tr_l2; test_loss=0.011912 mae=0.074325
run_2026-03-21_193626	0.162539	discard	transformer	exp294 e16 tr_l2; test_loss=0.026585 mae=0.118556
run_2026-03-21_193626	0.090833	discard	lstnet	exp294 e16 tr_l2; test_loss=0.008408 mae=0.066631
run_2026-03-21_193626	0.107279	discard	rescnn_gru	exp294 e16 tr_l2; test_loss=0.011932 mae=0.073155
run_2026-03-21_193626	0.056541	discard	nbeats	exp294 e16 tr_l2; test_loss=0.003266 mae=0.041151
run_2026-03-21_193626	0.108663	discard	nhits	exp294 e16 tr_l2; test_loss=0.014597 mae=0.047160
run_2026-03-21_193855	0.111009	discard	bilstm	exp295 e8 tr_drop005; test_loss=0.013199 mae=0.071891
run_2026-03-21_193855	0.193018	discard	transformer	exp295 e8 tr_drop005; test_loss=0.040589 mae=0.120140
run_2026-03-21_193855	0.098590	discard	lstnet	exp295 e8 tr_drop005; test_loss=0.010455 mae=0.065875
run_2026-03-21_193855	0.095008	discard	rescnn_gru	exp295 e8 tr_drop005; test_loss=0.009471 mae=0.067786
run_2026-03-21_193855	0.058264	discard	nbeats	exp295 e8 tr_drop005; test_loss=0.003454 mae=0.044234
run_2026-03-21_193855	0.117762	discard	nhits	exp295 e8 tr_drop005; test_loss=0.016974 mae=0.054076
run_2026-03-21_194230	0.120280	discard	bilstm	exp296 e12 lstnet_96; test_loss=0.015055 mae=0.079944
run_2026-03-21_194230	0.201619	discard	transformer	exp296 e12 lstnet_96; test_loss=0.044960 mae=0.119730
run_2026-03-21_194230	0.088409	discard	lstnet	exp296 e12 lstnet_96; test_loss=0.008302 mae=0.060023
run_2026-03-21_194230	0.120390	discard	rescnn_gru	exp296 e12 lstnet_96; test_loss=0.015504 mae=0.082335
run_2026-03-21_194230	0.053746	discard	nbeats	exp296 e12 lstnet_96; test_loss=0.002945 mae=0.040270
run_2026-03-21_194230	0.095153	discard	nhits	exp296 e12 lstnet_96; test_loss=0.010926 mae=0.046995
run_2026-03-21_194455	0.117680	discard	bilstm	exp297 e8 lstnet_112_96; test_loss=0.014666 mae=0.077216
run_2026-03-21_194455	0.183957	discard	transformer	exp297 e8 lstnet_112_96; test_loss=0.037361 mae=0.108460
run_2026-03-21_194455	0.098473	discard	lstnet	exp297 e8 lstnet_112_96; test_loss=0.010269 mae=0.068308
run_2026-03-21_194455	0.099508	discard	rescnn_gru	exp297 e8 lstnet_112_96; test_loss=0.010091 mae=0.071647
run_2026-03-21_194455	0.056220	discard	nbeats	exp297 e8 lstnet_112_96; test_loss=0.003189 mae=0.042006
run_2026-03-21_194455	0.094195	discard	nhits	exp297 e8 lstnet_112_96; test_loss=0.010529 mae=0.049234
run_2026-03-21_194828	0.086787	discard	bilstm	exp298 e12 lstnet_96_112; test_loss=0.007899 mae=0.057242
run_2026-03-21_194828	0.137757	discard	transformer	exp298 e12 lstnet_96_112; test_loss=0.020129 mae=0.087351
run_2026-03-21_194828	0.093972	discard	lstnet	exp298 e12 lstnet_96_112; test_loss=0.009658 mae=0.059755
run_2026-03-21_194828	0.095180	discard	rescnn_gru	exp298 e12 lstnet_96_112; test_loss=0.009447 mae=0.066038
run_2026-03-21_194828	0.055513	discard	nbeats	exp298 e12 lstnet_96_112; test_loss=0.003117 mae=0.040926
run_2026-03-21_194828	0.097294	discard	nhits	exp298 e12 lstnet_96_112; test_loss=0.011094 mae=0.054004
run_2026-03-21_195053	0.082057	keep	bilstm	exp299 e8 rescnn_96; test_loss=0.006830 mae=0.057348
run_2026-03-21_195053	0.191905	discard	transformer	exp299 e8 rescnn_96; test_loss=0.040811 mae=0.105235
run_2026-03-21_195053	0.088303	discard	lstnet	exp299 e8 rescnn_96; test_loss=0.008091 mae=0.061684
run_2026-03-21_195053	0.096261	discard	rescnn_gru	exp299 e8 rescnn_96; test_loss=0.009481 mae=0.067651
run_2026-03-21_195053	0.059317	discard	nbeats	exp299 e8 rescnn_96; test_loss=0.003570 mae=0.044945
run_2026-03-21_195053	0.120647	discard	nhits	exp299 e8 rescnn_96; test_loss=0.017979 mae=0.053930
run_2026-03-21_195541	0.128228	discard	bilstm	exp300 e16 rescnn_112_96; test_loss=0.017357 mae=0.080841
run_2026-03-21_195541	0.202777	discard	transformer	exp300 e16 rescnn_112_96; test_loss=0.047844 mae=0.100200
run_2026-03-21_195541	0.100384	discard	lstnet	exp300 e16 rescnn_112_96; test_loss=0.010958 mae=0.064941
run_2026-03-21_195541	0.100476	discard	rescnn_gru	exp300 e16 rescnn_112_96; test_loss=0.010487 mae=0.071965
run_2026-03-21_195541	0.059681	discard	nbeats	exp300 e16 rescnn_112_96; test_loss=0.003641 mae=0.044891
run_2026-03-21_195541	0.086218	discard	nhits	exp300 e16 rescnn_112_96; test_loss=0.008493 mae=0.052256
run_2026-03-21_195806	0.132375	discard	bilstm	exp301 e8 rescnn_96_112; test_loss=0.019033 mae=0.082791
run_2026-03-21_195806	0.194622	discard	transformer	exp301 e8 rescnn_96_112; test_loss=0.041836 mae=0.113687
run_2026-03-21_195806	0.091228	discard	lstnet	exp301 e8 rescnn_96_112; test_loss=0.008573 mae=0.065596
run_2026-03-21_195806	0.083788	discard	rescnn_gru	exp301 e8 rescnn_96_112; test_loss=0.007025 mae=0.062023
run_2026-03-21_195806	0.063783	discard	nbeats	exp301 e8 rescnn_96_112; test_loss=0.004110 mae=0.049695
run_2026-03-21_195806	0.105254	discard	nhits	exp301 e8 rescnn_96_112; test_loss=0.013590 mae=0.047500
run_2026-03-21_200022	0.109636	discard	bilstm	exp302 e12 nbeats_320_b5; test_loss=0.012698 mae=0.070797
run_2026-03-21_200022	0.230539	discard	transformer	exp302 e12 nbeats_320_b5; test_loss=0.060127 mae=0.130033
run_2026-03-21_200022	0.087437	discard	lstnet	exp302 e12 nbeats_320_b5; test_loss=0.007911 mae=0.062058
run_2026-03-21_200022	0.096141	discard	rescnn_gru	exp302 e12 nbeats_320_b5; test_loss=0.009373 mae=0.070074
run_2026-03-21_200022	0.069136	discard	nbeats	exp302 e12 nbeats_320_b5; test_loss=0.004806 mae=0.053829
run_2026-03-21_200022	0.075726	discard	nhits	exp302 e12 nbeats_320_b5; test_loss=0.006344 mae=0.048569
run_2026-03-21_200208	0.132071	discard	bilstm	exp303 e8 nbeats_384_b6; test_loss=0.018115 mae=0.089546
run_2026-03-21_200208	0.191680	discard	transformer	exp303 e8 nbeats_384_b6; test_loss=0.041877 mae=0.098870
run_2026-03-21_200208	0.109361	discard	lstnet	exp303 e8 nbeats_384_b6; test_loss=0.013232 mae=0.067994
run_2026-03-21_200208	0.105235	discard	rescnn_gru	exp303 e8 nbeats_384_b6; test_loss=0.012205 mae=0.064428
run_2026-03-21_200208	0.058860	discard	nbeats	exp303 e8 nbeats_384_b6; test_loss=0.003546 mae=0.044703
run_2026-03-21_200208	0.086797	discard	nhits	exp303 e8 nbeats_384_b6; test_loss=0.008976 mae=0.043988
