commit	RMSE	status	model	description
run_2026-03-21_161823	0.052162	discard	nbeats	exp215 e8 lr3e-4_e20; test_loss=0.002787 mae=0.039106
run_2026-03-21_161823	0.098505	discard	nhits	exp215 e8 lr3e-4_e20; test_loss=0.011109 mae=0.058703
run_2026-03-21_162028	0.116030	discard	bilstm	exp216 e16 batch80; test_loss=0.013914 mae=0.082360
run_2026-03-21_162028	0.205582	discard	transformer	exp216 e16 batch80; test_loss=0.054585 mae=0.094364
run_2026-03-21_162028	0.086510	discard	lstnet	exp216 e16 batch80; test_loss=0.009322 mae=0.050555
run_2026-03-21_162028	0.088632	discard	rescnn_gru	exp216 e16 batch80; test_loss=0.008682 mae=0.059735
run_2026-03-21_162028	0.055834	discard	nbeats	exp216 e16 batch80; test_loss=0.003225 mae=0.042389
run_2026-03-21_162028	0.094649	discard	nhits	exp216 e16 batch80; test_loss=0.012996 mae=0.042702
run_2026-03-21_162124	0.107275	discard	bilstm	exp217 e8 batch96; test_loss=0.011702 mae=0.075738
run_2026-03-21_162124	0.180323	discard	transformer	exp217 e8 batch96; test_loss=0.035298 mae=0.106812
run_2026-03-21_162124	0.096107	discard	lstnet	exp217 e8 batch96; test_loss=0.009328 mae=0.071097
run_2026-03-21_162124	0.140053	discard	rescnn_gru	exp217 e8 batch96; test_loss=0.021179 mae=0.086838
run_2026-03-21_162124	0.070480	discard	nbeats	exp217 e8 batch96; test_loss=0.005031 mae=0.053440
run_2026-03-21_162124	0.111923	discard	nhits	exp217 e8 batch96; test_loss=0.014157 mae=0.057296
run_2026-03-21_162358	0.102842	discard	bilstm	exp218 e12 bilstm_h160; test_loss=0.010762 mae=0.073564
run_2026-03-21_162358	0.200537	discard	transformer	exp218 e12 bilstm_h160; test_loss=0.045855 mae=0.102970
run_2026-03-21_162358	0.089888	discard	lstnet	exp218 e12 bilstm_h160; test_loss=0.008327 mae=0.065095
run_2026-03-21_162358	0.095037	discard	rescnn_gru	exp218 e12 bilstm_h160; test_loss=0.009735 mae=0.062087
run_2026-03-21_162358	0.067604	discard	nbeats	exp218 e12 bilstm_h160; test_loss=0.004663 mae=0.051025
run_2026-03-21_162358	0.074153	discard	nhits	exp218 e12 bilstm_h160; test_loss=0.006396 mae=0.041529
run_2026-03-21_162549	0.115730	discard	bilstm	exp219 e8 bilstm_h192; test_loss=0.014915 mae=0.064278
run_2026-03-21_162549	0.215987	discard	transformer	exp219 e8 bilstm_h192; test_loss=0.052660 mae=0.113603
run_2026-03-21_162549	0.131367	discard	lstnet	exp219 e8 bilstm_h192; test_loss=0.019793 mae=0.073832
run_2026-03-21_162549	0.122817	discard	rescnn_gru	exp219 e8 bilstm_h192; test_loss=0.016591 mae=0.076690
run_2026-03-21_162549	0.063906	discard	nbeats	exp219 e8 bilstm_h192; test_loss=0.004137 mae=0.048030
run_2026-03-21_162549	0.094955	discard	nhits	exp219 e8 bilstm_h192; test_loss=0.010859 mae=0.047009
run_2026-03-21_162751	0.093125	discard	bilstm	exp220 e12 bilstm_l3; test_loss=0.008978 mae=0.065204
run_2026-03-21_162751	0.206492	discard	transformer	exp220 e12 bilstm_l3; test_loss=0.047194 mae=0.115311
run_2026-03-21_162751	0.085723	discard	lstnet	exp220 e12 bilstm_l3; test_loss=0.007515 mae=0.062864
run_2026-03-21_162751	0.091259	discard	rescnn_gru	exp220 e12 bilstm_l3; test_loss=0.008626 mae=0.064534
run_2026-03-21_162751	0.058972	discard	nbeats	exp220 e12 bilstm_l3; test_loss=0.003510 mae=0.043707
run_2026-03-21_162751	0.074956	discard	nhits	exp220 e12 bilstm_l3; test_loss=0.006466 mae=0.044627
run_2026-03-21_162909	0.088044	discard	bilstm	exp221 e8 tr_d128_ff384; test_loss=0.007997 mae=0.059341
run_2026-03-21_162909	0.193594	discard	transformer	exp221 e8 tr_d128_ff384; test_loss=0.041748 mae=0.106343
run_2026-03-21_162909	0.102906	discard	lstnet	exp221 e8 tr_d128_ff384; test_loss=0.011326 mae=0.070326
run_2026-03-21_162909	0.124259	discard	rescnn_gru	exp221 e8 tr_d128_ff384; test_loss=0.017009 mae=0.077790
run_2026-03-21_162909	0.055577	discard	nbeats	exp221 e8 tr_d128_ff384; test_loss=0.003186 mae=0.040483
run_2026-03-21_162909	0.075601	discard	nhits	exp221 e8 tr_d128_ff384; test_loss=0.006634 mae=0.043632
run_2026-03-21_163155	0.110472	discard	bilstm	exp222 e16 tr_l2; test_loss=0.012590 mae=0.073860
run_2026-03-21_163155	0.177528	discard	transformer	exp222 e16 tr_l2; test_loss=0.033215 mae=0.122886
run_2026-03-21_163155	0.123751	discard	lstnet	exp222 e16 tr_l2; test_loss=0.017825 mae=0.065568
run_2026-03-21_163155	0.127647	discard	rescnn_gru	exp222 e16 tr_l2; test_loss=0.017947 mae=0.082593
run_2026-03-21_163155	0.053218	discard	nbeats	exp222 e16 tr_l2; test_loss=0.002863 mae=0.039361
run_2026-03-21_163155	0.114870	discard	nhits	exp222 e16 tr_l2; test_loss=0.016331 mae=0.048964
run_2026-03-21_163316	0.109749	discard	bilstm	exp223 e8 tr_drop005; test_loss=0.012295 mae=0.075791
run_2026-03-21_163316	0.181606	discard	transformer	exp223 e8 tr_drop005; test_loss=0.035832 mae=0.108554
run_2026-03-21_163316	0.093232	discard	lstnet	exp223 e8 tr_drop005; test_loss=0.009422 mae=0.060099
run_2026-03-21_163316	0.098572	discard	rescnn_gru	exp223 e8 tr_drop005; test_loss=0.009880 mae=0.069969
run_2026-03-21_163316	0.059077	discard	nbeats	exp223 e8 tr_drop005; test_loss=0.003571 mae=0.043666
run_2026-03-21_163316	0.101056	discard	nhits	exp223 e8 tr_drop005; test_loss=0.012550 mae=0.044729
run_2026-03-21_163511	0.097463	discard	bilstm	exp224 e12 lstnet_96; test_loss=0.009762 mae=0.069516
run_2026-03-21_163511	0.184947	discard	transformer	exp224 e12 lstnet_96; test_loss=0.036568 mae=0.110312
run_2026-03-21_163511	0.098921	discard	lstnet	exp224 e12 lstnet_96; test_loss=0.011010 mae=0.056906
run_2026-03-21_163511	0.083785	discard	rescnn_gru	exp224 e12 lstnet_96; test_loss=0.007101 mae=0.060865
run_2026-03-21_163511	0.061224	discard	nbeats	exp224 e12 lstnet_96; test_loss=0.003791 mae=0.046535
run_2026-03-21_163511	0.110061	discard	nhits	exp224 e12 lstnet_96; test_loss=0.014924 mae=0.048021
run_2026-03-21_163629	0.111370	discard	bilstm	exp225 e8 lstnet_112_96; test_loss=0.013008 mae=0.072380
run_2026-03-21_163629	0.220523	discard	transformer	exp225 e8 lstnet_112_96; test_loss=0.054654 mae=0.121976
run_2026-03-21_163629	0.094661	discard	lstnet	exp225 e8 lstnet_112_96; test_loss=0.009872 mae=0.059159
run_2026-03-21_163629	0.099695	discard	rescnn_gru	exp225 e8 lstnet_112_96; test_loss=0.010361 mae=0.069140
run_2026-03-21_163629	0.054537	discard	nbeats	exp225 e8 lstnet_112_96; test_loss=0.003066 mae=0.039268
run_2026-03-21_163629	0.081428	discard	nhits	exp225 e8 lstnet_112_96; test_loss=0.007522 mae=0.051004
run_2026-03-21_163823	0.109570	discard	bilstm	exp226 e12 lstnet_96_112; test_loss=0.012471 mae=0.074161
run_2026-03-21_163823	0.222031	discard	transformer	exp226 e12 lstnet_96_112; test_loss=0.056282 mae=0.116292
run_2026-03-21_163823	0.097223	discard	lstnet	exp226 e12 lstnet_96_112; test_loss=0.010519 mae=0.060212
run_2026-03-21_163823	0.087358	discard	rescnn_gru	exp226 e12 lstnet_96_112; test_loss=0.007949 mae=0.060705
run_2026-03-21_163823	0.055563	discard	nbeats	exp226 e12 lstnet_96_112; test_loss=0.003135 mae=0.043155
run_2026-03-21_163823	0.101273	discard	nhits	exp226 e12 lstnet_96_112; test_loss=0.012643 mae=0.044571
run_2026-03-21_163943	0.104069	discard	bilstm	exp227 e8 rescnn_96; test_loss=0.011020 mae=0.074191
run_2026-03-21_163943	0.164649	discard	transformer	exp227 e8 rescnn_96; test_loss=0.029082 mae=0.101695
run_2026-03-21_163943	0.110592	discard	lstnet	exp227 e8 rescnn_96; test_loss=0.013684 mae=0.066854
run_2026-03-21_163943	0.086891	discard	rescnn_gru	exp227 e8 rescnn_96; test_loss=0.007766 mae=0.062074
run_2026-03-21_163943	0.061311	discard	nbeats	exp227 e8 rescnn_96; test_loss=0.003811 mae=0.046626
run_2026-03-21_163943	0.106296	discard	nhits	exp227 e8 rescnn_96; test_loss=0.013152 mae=0.062731
run_2026-03-21_164214	0.116746	discard	bilstm	exp228 e16 rescnn_112_96; test_loss=0.014611 mae=0.074022
run_2026-03-21_164214	0.231394	discard	transformer	exp228 e16 rescnn_112_96; test_loss=0.060959 mae=0.121201
run_2026-03-21_164214	0.083022	discard	lstnet	exp228 e16 rescnn_112_96; test_loss=0.007159 mae=0.057486
run_2026-03-21_164214	0.089204	discard	rescnn_gru	exp228 e16 rescnn_112_96; test_loss=0.008018 mae=0.062939
run_2026-03-21_164214	0.068658	discard	nbeats	exp228 e16 rescnn_112_96; test_loss=0.004783 mae=0.053810
run_2026-03-21_164214	0.095237	discard	nhits	exp228 e16 rescnn_112_96; test_loss=0.011072 mae=0.044583
run_2026-03-21_164325	0.147157	discard	bilstm	exp229 e8 rescnn_96_112; test_loss=0.023188 mae=0.092665
run_2026-03-21_164325	0.154773	discard	transformer	exp229 e8 rescnn_96_112; test_loss=0.026342 mae=0.086984
run_2026-03-21_164325	0.078813	discard	lstnet	exp229 e8 rescnn_96_112; test_loss=0.006289 mae=0.058186
run_2026-03-21_164325	0.091743	discard	rescnn_gru	exp229 e8 rescnn_96_112; test_loss=0.008599 mae=0.064936
run_2026-03-21_164325	0.056861	discard	nbeats	exp229 e8 rescnn_96_112; test_loss=0.003341 mae=0.041853
run_2026-03-21_164325	0.093678	discard	nhits	exp229 e8 rescnn_96_112; test_loss=0.010613 mae=0.045302
run_2026-03-21_164523	0.093311	discard	bilstm	exp230 e12 nbeats_320_b5; test_loss=0.008857 mae=0.065569
run_2026-03-21_164523	0.158975	discard	transformer	exp230 e12 nbeats_320_b5; test_loss=0.027884 mae=0.092703
run_2026-03-21_164523	0.103599	discard	lstnet	exp230 e12 nbeats_320_b5; test_loss=0.011824 mae=0.065472
run_2026-03-21_164523	0.102718	discard	rescnn_gru	exp230 e12 nbeats_320_b5; test_loss=0.011199 mae=0.069683
run_2026-03-21_164523	0.054952	discard	nbeats	exp230 e12 nbeats_320_b5; test_loss=0.003061 mae=0.041264
run_2026-03-21_164523	0.065314	discard	nhits	exp230 e12 nbeats_320_b5; test_loss=0.004586 mae=0.045572
run_2026-03-21_164650	0.121388	discard	bilstm	exp231 e8 nbeats_384_b6; test_loss=0.016332 mae=0.067310
run_2026-03-21_164650	0.197873	discard	transformer	exp231 e8 nbeats_384_b6; test_loss=0.043091 mae=0.109796
run_2026-03-21_164650	0.101339	discard	lstnet	exp231 e8 nbeats_384_b6; test_loss=0.011018 mae=0.068349
run_2026-03-21_164650	0.101229	discard	rescnn_gru	exp231 e8 nbeats_384_b6; test_loss=0.010593 mae=0.072313
run_2026-03-21_164650	0.059563	discard	nbeats	exp231 e8 nbeats_384_b6; test_loss=0.003596 mae=0.046223
run_2026-03-21_164650	0.082468	discard	nhits	exp231 e8 nbeats_384_b6; test_loss=0.007852 mae=0.048904
run_2026-03-21_164901	0.120175	discard	bilstm	exp232 e12 nbeats_448_b6; test_loss=0.014773 mae=0.083987
run_2026-03-21_164901	0.184097	discard	transformer	exp232 e12 nbeats_448_b6; test_loss=0.038511 mae=0.101373
run_2026-03-21_164901	0.098980	discard	lstnet	exp232 e12 nbeats_448_b6; test_loss=0.010243 mae=0.070800
run_2026-03-21_164901	0.122471	discard	rescnn_gru	exp232 e12 nbeats_448_b6; test_loss=0.015580 mae=0.088431
run_2026-03-21_164901	0.068758	discard	nbeats	exp232 e12 nbeats_448_b6; test_loss=0.004770 mae=0.053739
run_2026-03-21_164901	0.114176	discard	nhits	exp232 e12 nbeats_448_b6; test_loss=0.016261 mae=0.047493
run_2026-03-21_165016	0.115604	discard	bilstm	exp233 e8 nhits_320_b3; test_loss=0.014347 mae=0.071389
run_2026-03-21_165016	0.149617	discard	transformer	exp233 e8 nhits_320_b3; test_loss=0.023587 mae=0.094815
run_2026-03-21_165016	0.089727	discard	lstnet	exp233 e8 nhits_320_b3; test_loss=0.008483 mae=0.062703
run_2026-03-21_165016	0.138556	discard	rescnn_gru	exp233 e8 nhits_320_b3; test_loss=0.021166 mae=0.087814
run_2026-03-21_165016	0.059889	discard	nbeats	exp233 e8 nhits_320_b3; test_loss=0.003618 mae=0.046435
run_2026-03-21_165016	0.126826	discard	nhits	exp233 e8 nhits_320_b3; test_loss=0.018654 mae=0.077806
run_2026-03-21_165247	0.135613	discard	bilstm	exp234 e16 nhits_384_b4; test_loss=0.018769 mae=0.097090
run_2026-03-21_165247	0.191118	discard	transformer	exp234 e16 nhits_384_b4; test_loss=0.041780 mae=0.095044
run_2026-03-21_165247	0.122604	discard	lstnet	exp234 e16 nhits_384_b4; test_loss=0.017096 mae=0.072496
run_2026-03-21_165247	0.104524	discard	rescnn_gru	exp234 e16 nhits_384_b4; test_loss=0.011523 mae=0.072725
run_2026-03-21_165247	0.057677	discard	nbeats	exp234 e16 nhits_384_b4; test_loss=0.003400 mae=0.043393
run_2026-03-21_165247	0.105568	discard	nhits	exp234 e16 nhits_384_b4; test_loss=0.013470 mae=0.052110
run_2026-03-21_165404	0.105783	discard	bilstm	exp235 e8 nhits_448_b4; test_loss=0.011857 mae=0.068153
run_2026-03-21_165404	0.158418	discard	transformer	exp235 e8 nhits_448_b4; test_loss=0.027170 mae=0.095942
run_2026-03-21_165404	0.117568	discard	lstnet	exp235 e8 nhits_448_b4; test_loss=0.014736 mae=0.080155
run_2026-03-21_165404	0.107352	discard	rescnn_gru	exp235 e8 nhits_448_b4; test_loss=0.012338 mae=0.071967
run_2026-03-21_165404	0.055948	discard	nbeats	exp235 e8 nhits_448_b4; test_loss=0.003172 mae=0.042790
run_2026-03-21_165404	0.095810	discard	nhits	exp235 e8 nhits_448_b4; test_loss=0.010488 mae=0.055957
run_2026-03-21_165554	0.124066	discard	bilstm	exp236 e12 wd1e-5; test_loss=0.016637 mae=0.074082
run_2026-03-21_165554	0.177781	discard	transformer	exp236 e12 wd1e-5; test_loss=0.033435 mae=0.114648
run_2026-03-21_165554	0.121873	discard	lstnet	exp236 e12 wd1e-5; test_loss=0.016955 mae=0.069349
run_2026-03-21_165554	0.117470	discard	rescnn_gru	exp236 e12 wd1e-5; test_loss=0.013918 mae=0.085965
run_2026-03-21_165554	0.049789	discard	nbeats	exp236 e12 wd1e-5; test_loss=0.002532 mae=0.037101
run_2026-03-21_165554	0.115228	discard	nhits	exp236 e12 wd1e-5; test_loss=0.016616 mae=0.045576
run_2026-03-21_165710	0.119382	discard	bilstm	exp237 e8 wd5e-5; test_loss=0.015753 mae=0.068631
run_2026-03-21_165710	0.200292	discard	transformer	exp237 e8 wd5e-5; test_loss=0.045969 mae=0.100846
run_2026-03-21_165710	0.097991	discard	lstnet	exp237 e8 wd5e-5; test_loss=0.010715 mae=0.059795
run_2026-03-21_165710	0.095653	discard	rescnn_gru	exp237 e8 wd5e-5; test_loss=0.009648 mae=0.065723
run_2026-03-21_165710	0.064551	discard	nbeats	exp237 e8 wd5e-5; test_loss=0.004225 mae=0.047511
run_2026-03-21_165710	0.089709	discard	nhits	exp237 e8 wd5e-5; test_loss=0.009504 mae=0.049435
run_2026-03-21_165901	0.117804	discard	bilstm	exp238 e12 lr7e-4; test_loss=0.014023 mae=0.079861
run_2026-03-21_165901	0.214025	discard	transformer	exp238 e12 lr7e-4; test_loss=0.050445 mae=0.123959
run_2026-03-21_165901	0.085181	discard	lstnet	exp238 e12 lr7e-4; test_loss=0.007317 mae=0.061028
run_2026-03-21_165901	0.119578	discard	rescnn_gru	exp238 e12 lr7e-4; test_loss=0.014802 mae=0.085970
run_2026-03-21_165901	0.051880	discard	nbeats	exp238 e12 lr7e-4; test_loss=0.002719 mae=0.039103
run_2026-03-21_165901	0.097053	discard	nhits	exp238 e12 lr7e-4; test_loss=0.011075 mae=0.053892
run_2026-03-21_170159	0.123417	discard	bilstm	exp239 e8 lr3e-4_e20; test_loss=0.016472 mae=0.078242
run_2026-03-21_170159	0.154617	discard	transformer	exp239 e8 lr3e-4_e20; test_loss=0.025004 mae=0.100116
run_2026-03-21_170159	0.099699	discard	lstnet	exp239 e8 lr3e-4_e20; test_loss=0.011041 mae=0.063072
run_2026-03-21_170159	0.107438	discard	rescnn_gru	exp239 e8 lr3e-4_e20; test_loss=0.012786 mae=0.068374
run_2026-03-21_170159	0.055949	discard	nbeats	exp239 e8 lr3e-4_e20; test_loss=0.003201 mae=0.041292
run_2026-03-21_170159	0.073072	discard	nhits	exp239 e8 lr3e-4_e20; test_loss=0.005808 mae=0.048469
run_2026-03-21_170357	0.121404	discard	bilstm	exp240 e16 batch80; test_loss=0.015184 mae=0.087154
run_2026-03-21_170357	0.190633	discard	transformer	exp240 e16 batch80; test_loss=0.046038 mae=0.096238
run_2026-03-21_170357	0.082742	discard	lstnet	exp240 e16 batch80; test_loss=0.007229 mae=0.059997
run_2026-03-21_170357	0.089768	discard	rescnn_gru	exp240 e16 batch80; test_loss=0.008319 mae=0.064548
run_2026-03-21_170357	0.060147	discard	nbeats	exp240 e16 batch80; test_loss=0.003676 mae=0.045016
run_2026-03-21_170357	0.115681	discard	nhits	exp240 e16 batch80; test_loss=0.019848 mae=0.048964
run_2026-03-21_170452	0.112833	discard	bilstm	exp241 e8 batch96; test_loss=0.013049 mae=0.079900
run_2026-03-21_170452	0.186762	discard	transformer	exp241 e8 batch96; test_loss=0.037410 mae=0.114811
run_2026-03-21_170452	0.110401	discard	lstnet	exp241 e8 batch96; test_loss=0.013124 mae=0.069550
run_2026-03-21_170452	0.110090	discard	rescnn_gru	exp241 e8 batch96; test_loss=0.012530 mae=0.078296
run_2026-03-21_170452	0.062687	discard	nbeats	exp241 e8 batch96; test_loss=0.003971 mae=0.046645
run_2026-03-21_170452	0.079456	discard	nhits	exp241 e8 batch96; test_loss=0.006629 mae=0.056526
run_2026-03-21_170715	0.096131	discard	bilstm	exp242 e12 bilstm_h160; test_loss=0.009935 mae=0.060003
run_2026-03-21_170715	0.192161	discard	transformer	exp242 e12 bilstm_h160; test_loss=0.043007 mae=0.090478
run_2026-03-21_170715	0.089951	discard	lstnet	exp242 e12 bilstm_h160; test_loss=0.008597 mae=0.061875
run_2026-03-21_170715	0.107665	discard	rescnn_gru	exp242 e12 bilstm_h160; test_loss=0.012314 mae=0.072129
run_2026-03-21_170715	0.051754	discard	nbeats	exp242 e12 bilstm_h160; test_loss=0.002730 mae=0.038905
run_2026-03-21_170715	0.122706	discard	nhits	exp242 e12 bilstm_h160; test_loss=0.018410 mae=0.057361
run_2026-03-21_170858	0.095390	discard	bilstm	exp243 e8 bilstm_h192; test_loss=0.009412 mae=0.063844
run_2026-03-21_170858	0.215033	discard	transformer	exp243 e8 bilstm_h192; test_loss=0.052131 mae=0.111561
run_2026-03-21_170858	0.122135	discard	lstnet	exp243 e8 bilstm_h192; test_loss=0.017249 mae=0.066355
run_2026-03-21_170858	0.106760	discard	rescnn_gru	exp243 e8 bilstm_h192; test_loss=0.012329 mae=0.069688
run_2026-03-21_170858	0.069153	discard	nbeats	exp243 e8 bilstm_h192; test_loss=0.004831 mae=0.052258
run_2026-03-21_170858	0.072547	discard	nhits	exp243 e8 bilstm_h192; test_loss=0.006044 mae=0.042212
run_2026-03-21_171049	0.113704	discard	bilstm	exp244 e12 bilstm_l3; test_loss=0.013903 mae=0.073147
run_2026-03-21_171049	0.208287	discard	transformer	exp244 e12 bilstm_l3; test_loss=0.049672 mae=0.109370
run_2026-03-21_171049	0.100410	discard	lstnet	exp244 e12 bilstm_l3; test_loss=0.010942 mae=0.065438
run_2026-03-21_171049	0.095416	discard	rescnn_gru	exp244 e12 bilstm_l3; test_loss=0.009215 mae=0.070527
run_2026-03-21_171049	0.065971	discard	nbeats	exp244 e12 bilstm_l3; test_loss=0.004419 mae=0.049918
run_2026-03-21_171049	0.084395	discard	nhits	exp244 e12 bilstm_l3; test_loss=0.008496 mae=0.044175
run_2026-03-21_171201	0.122216	discard	bilstm	exp245 e8 tr_d128_ff384; test_loss=0.015842 mae=0.078801
run_2026-03-21_171201	0.181717	discard	transformer	exp245 e8 tr_d128_ff384; test_loss=0.036393 mae=0.104875
run_2026-03-21_171201	0.081372	discard	lstnet	exp245 e8 tr_d128_ff384; test_loss=0.006652 mae=0.061206
run_2026-03-21_171201	0.091769	discard	rescnn_gru	exp245 e8 tr_d128_ff384; test_loss=0.008487 mae=0.067092
run_2026-03-21_171201	0.068532	discard	nbeats	exp245 e8 tr_d128_ff384; test_loss=0.004749 mae=0.052856
run_2026-03-21_171201	0.077765	discard	nhits	exp245 e8 tr_d128_ff384; test_loss=0.006722 mae=0.050549
run_2026-03-21_171433	0.124922	discard	bilstm	exp246 e16 tr_l2; test_loss=0.016134 mae=0.085965
run_2026-03-21_171433	0.207912	discard	transformer	exp246 e16 tr_l2; test_loss=0.045023 mae=0.152059
run_2026-03-21_171433	0.091278	discard	lstnet	exp246 e16 tr_l2; test_loss=0.008626 mae=0.065393
run_2026-03-21_171433	0.129757	discard	rescnn_gru	exp246 e16 tr_l2; test_loss=0.019114 mae=0.073757
run_2026-03-21_171433	0.068873	discard	nbeats	exp246 e16 tr_l2; test_loss=0.004856 mae=0.052221
run_2026-03-21_171433	0.085093	discard	nhits	exp246 e16 tr_l2; test_loss=0.008719 mae=0.042921
run_2026-03-21_171549	0.148825	discard	bilstm	exp247 e8 tr_drop005; test_loss=0.023101 mae=0.099627
run_2026-03-21_171549	0.203169	discard	transformer	exp247 e8 tr_drop005; test_loss=0.046897 mae=0.099078
run_2026-03-21_171549	0.104335	discard	lstnet	exp247 e8 tr_drop005; test_loss=0.011421 mae=0.075336
run_2026-03-21_171549	0.098705	discard	rescnn_gru	exp247 e8 tr_drop005; test_loss=0.009759 mae=0.070517
run_2026-03-21_171549	0.051748	discard	nbeats	exp247 e8 tr_drop005; test_loss=0.002802 mae=0.037364
run_2026-03-21_171549	0.112743	discard	nhits	exp247 e8 tr_drop005; test_loss=0.015908 mae=0.043302
run_2026-03-21_171738	0.100519	discard	bilstm	exp248 e12 lstnet_96; test_loss=0.010180 mae=0.073480
run_2026-03-21_171738	0.186012	discard	transformer	exp248 e12 lstnet_96; test_loss=0.038600 mae=0.100882
run_2026-03-21_171738	0.081580	discard	lstnet	exp248 e12 lstnet_96; test_loss=0.007284 mae=0.051450
run_2026-03-21_171738	0.120459	discard	rescnn_gru	exp248 e12 lstnet_96; test_loss=0.015600 mae=0.080459
run_2026-03-21_171738	0.057129	discard	nbeats	exp248 e12 lstnet_96; test_loss=0.003289 mae=0.043048
run_2026-03-21_171738	0.123215	discard	nhits	exp248 e12 lstnet_96; test_loss=0.018423 mae=0.060824
run_2026-03-21_171852	0.102947	discard	bilstm	exp249 e8 lstnet_112_96; test_loss=0.010894 mae=0.070723
run_2026-03-21_171852	0.183850	discard	transformer	exp249 e8 lstnet_112_96; test_loss=0.037747 mae=0.101567
run_2026-03-21_171852	0.098200	discard	lstnet	exp249 e8 lstnet_112_96; test_loss=0.010224 mae=0.069259
run_2026-03-21_171852	0.111015	discard	rescnn_gru	exp249 e8 lstnet_112_96; test_loss=0.013283 mae=0.074858
run_2026-03-21_171852	0.052533	discard	nbeats	exp249 e8 lstnet_112_96; test_loss=0.002825 mae=0.039087
run_2026-03-21_171852	0.069186	discard	nhits	exp249 e8 lstnet_112_96; test_loss=0.005157 mae=0.047052
run_2026-03-21_172040	0.123433	discard	bilstm	exp250 e12 lstnet_96_112; test_loss=0.015620 mae=0.086296
run_2026-03-21_172040	0.195684	discard	transformer	exp250 e12 lstnet_96_112; test_loss=0.042239 mae=0.109942
run_2026-03-21_172040	0.084706	discard	lstnet	exp250 e12 lstnet_96_112; test_loss=0.007414 mae=0.062363
run_2026-03-21_172040	0.090084	discard	rescnn_gru	exp250 e12 lstnet_96_112; test_loss=0.008461 mae=0.063992
run_2026-03-21_172040	0.056758	discard	nbeats	exp250 e12 lstnet_96_112; test_loss=0.003290 mae=0.041938
run_2026-03-21_172040	0.098538	discard	nhits	exp250 e12 lstnet_96_112; test_loss=0.011658 mae=0.050109
run_2026-03-21_172152	0.124669	discard	bilstm	exp251 e8 rescnn_96; test_loss=0.015727 mae=0.091622
run_2026-03-21_172152	0.159031	discard	transformer	exp251 e8 rescnn_96; test_loss=0.027807 mae=0.092098
run_2026-03-21_172152	0.102496	discard	lstnet	exp251 e8 rescnn_96; test_loss=0.011183 mae=0.068388
